title,question_text,category_name,is_required,allow_multiple_selection,option_1,option_2,option_3,option_4,option_5,option_6,correct_answers,question_text_ar,option_1_ar,option_2_ar,option_3_ar,option_4_ar,option_5_ar,option_6_ar
Work Environment,What type of work environment helps you perform best?,Work Preferences,TRUE,FALSE,Quiet and organized,Collaborative and social,Fast-paced and dynamic,Flexible and remote,Structured and routine,,"1,3",ما نوع بيئة العمل التي تساعدك على الأداء الأفضل؟,هادئة ومنظمة,تعاونية واجتماعية,سريعة وديناميكية,مرنة وعن بعد,منظمة وروتينية,
Top Skills,Which skills do you excel at? (Select all that apply),Skills Evaluation,TRUE,TRUE,Analytical thinking,Creative problem-solving,Communication,Technical skills,Project management,Leadership,"1,2,3",ما هي المهارات التي تتفوق فيها؟ (اختر جميع ما ينطبق),التفكير التحليلي,حل المشكلات الإبداعي,التواصل,المهارات الفنية,إدارة المشاريع,القيادة
Career Motivation,What motivates you most in your career?,Career Goals,TRUE,FALSE,Financial success,Making an impact,Personal growth,Work-life balance,Recognition and status,Job security,1,ما الذي يحفزك أكثر في مسيرتك المهنية؟,النجاح المالي,إحداث تأثير,النمو الشخصي,التوازن بين العمل والحياة,التقدير والمكانة,الأمان الوظيفي
Learning Style,How do you prefer to learn new things?,Personal Growth,TRUE,FALSE,Reading and self-study,Hands-on practice,Structured courses,Mentorship,Group discussions,Video tutorials,2,كيف تفضل تعلم أشياء جديدة؟,القراءة والدراسة الذاتية,الممارسة العملية,الدورات المنظمة,الإرشاد,المناقشات الجماعية,دروس الفيديو
Work Schedule,What's your ideal work schedule?,Work Preferences,FALSE,FALSE,Traditional 9-5,Flexible hours,Night shifts,Weekend work,Project-based,,"1,2",ما هو جدول العمل المثالي بالنسبة لك؟,التقليدي 9-5,ساعات مرنة,نوبات ليلية,عمل نهاية الأسبوع,حسب المشروع,
Decision Making,How do you typically make important decisions?,Personality Assessment,TRUE,FALSE,Based on data and facts,Following my intuition,Consulting with others,Taking time to reflect,Quick and decisive,,"1,3",كيف تتخذ القرارات المهمة عادةً؟,بناءً على البيانات والحقائق,اتباع حدسي,استشارة الآخرين,أخذ وقت للتفكير,سريع وحاسم,
